{
    "$schema": "http://json-schema.org/draft-04/schema#",
    "type": "object",
    "properties": {
        "primitiveID": {
            "type": "string"
        },
        "primitiveName": {
            "type": "string"
        },
        "properties": {
            "type": "object",
            "properties": {
                "name": {
                    "type": "object",
                    "properties": {
                        "expression": {
                            "type": "string"
                        },
                        "type": {
                            "type": "string"
                        },
                        "status": {
                            "type": "string"
                        },
                        "value": {
                            "type": "string"
                        }
                    },
                    "required": [
                        "expression",
                        "type",
                        "status",
                        "value"
                    ]
                },
                "aliasName": {
                    "type": "object",
                    "properties": {
                        "expression": {
                            "type": "string"
                        },
                        "type": {
                            "type": "string"
                        },
                        "status": {
                            "type": "string"
                        },
                        "value": {
                            "type": "string"
                        }
                    },
                    "required": [
                        "expression",
                        "type",
                        "status",
                        "value"
                    ]
                },
                "description": {
                    "type": "object",
                    "properties": {
                        "expression": {
                            "type": "string"
                        },
                        "type": {
                            "type": "string"
                        },
                        "status": {
                            "type": "string"
                        },
                        "value": {
                            "type": "string"
                        }
                    },
                    "required": [
                        "expression",
                        "type",
                        "status",
                        "value"
                    ]
                },
                "normallylnService": {
                    "type": "object",
                    "properties": {
                        "expression": {
                            "type": "string"
                        },
                        "type": {
                            "type": "string"
                        },
                        "status": {
                            "type": "string"
                        },
                        "value": {
                            "type": "string"
                        }
                    },
                    "required": [
                        "expression",
                        "type",
                        "status",
                        "value"
                    ]
                },
                "type": {
                    "type": "object",
                    "properties": {
                        "expression": {
                            "type": "string"
                        },
                        "type": {
                            "type": "string"
                        },
                        "status": {
                            "type": "string"
                        },
                        "value": {
                            "type": "string"
                        }
                    },
                    "required": [
                        "expression",
                        "type",
                        "status",
                        "value"
                    ]
                },
                "accuracyClass": {
                    "type": "object",
                    "properties": {
                        "expression": {
                            "type": "string"
                        },
                        "type": {
                            "type": "string"
                        },
                        "status": {
                            "type": "string"
                        },
                        "value": {
                            "type": "string"
                        }
                    },
                    "required": [
                        "expression",
                        "type",
                        "status",
                        "value"
                    ]
                }
            },
            "required": [
                "name",
                "aliasName",
                "description",
                "normallylnService",
                "type",
                "accuracyClass"
            ]
        },
        "nodeTitle": {
            "type": "string"
        },
        "image": {
            "type": "string"
        },
        "initPorts": {
            "type": "array",
            "items": [
                {
                    "type": "object",
                    "properties": {
                        "type": {
                            "type": "array",
                            "items": [
                                {
                                    "type": "string"
                                },
                                {
                                    "type": "string"
                                }
                            ]
                        },
                        "properties": {
                            "type": "object",
                            "properties": {
                                "status": {
                                    "type": "object",
                                    "properties": {
                                        "type": {
                                            "type": "string"
                                        },
                                        "expression": {
                                            "type": "string"
                                        },
                                        "status": {
                                            "type": "string"
                                        },
                                        "value": {
                                            "type": "string"
                                        }
                                    },
                                    "required": [
                                        "type",
                                        "expression",
                                        "status",
                                        "value"
                                    ]
                                }
                            },
                            "required": [
                                "status"
                            ]
                        },
                        "primitiveName": {
                            "type": "string"
                        },
                        "initPosition": {
                            "type": "object",
                            "properties": {
                                "x": {
                                    "type": "number"
                                },
                                "y": {
                                    "type": "integer"
                                }
                            },
                            "required": [
                                "x",
                                "y"
                            ]
                        },
                        "primitiveID": {
                            "type": "string"
                        },
                        "location": {
                            "type": "object",
                            "properties": {
                                "x": {
                                    "type": "number"
                                },
                                "y": {
                                    "type": "number"
                                }
                            },
                            "required": [
                                "x",
                                "y"
                            ]
                        }
                    },
                    "required": [
                        "type",
                        "properties",
                        "primitiveName",
                        "initPosition",
                        "primitiveID",
                        "location"
                    ]
                },
                {
                    "type": "object",
                    "properties": {
                        "type": {
                            "type": "array",
                            "items": [
                                {
                                    "type": "string"
                                },
                                {
                                    "type": "string"
                                }
                            ]
                        },
                        "properties": {
                            "type": "object",
                            "properties": {
                                "status": {
                                    "type": "object",
                                    "properties": {
                                        "type": {
                                            "type": "string"
                                        },
                                        "expression": {
                                            "type": "string"
                                        },
                                        "status": {
                                            "type": "string"
                                        },
                                        "value": {
                                            "type": "string"
                                        }
                                    },
                                    "required": [
                                        "type",
                                        "expression",
                                        "status",
                                        "value"
                                    ]
                                }
                            },
                            "required": [
                                "status"
                            ]
                        },
                        "primitiveName": {
                            "type": "string"
                        },
                        "initPosition": {
                            "type": "object",
                            "properties": {
                                "x": {
                                    "type": "number"
                                },
                                "y": {
                                    "type": "integer"
                                }
                            },
                            "required": [
                                "x",
                                "y"
                            ]
                        },
                        "primitiveID": {
                            "type": "string"
                        },
                        "location": {
                            "type": "object",
                            "properties": {
                                "x": {
                                    "type": "number"
                                },
                                "y": {
                                    "type": "number"
                                }
                            },
                            "required": [
                                "x",
                                "y"
                            ]
                        }
                    },
                    "required": [
                        "type",
                        "properties",
                        "primitiveName",
                        "initPosition",
                        "primitiveID",
                        "location"
                    ]
                }
            ]
        },
        "layout": {
            "type": "object",
            "properties": {
                "x": {
                    "type": "integer"
                },
                "y": {
                    "type": "number"
                },
                "height": {
                    "type": "integer"
                },
                "width": {
                    "type": "integer"
                }
            },
            "required": [
                "x",
                "y",
                "height",
                "width"
            ]
        }
    },
    "required": [
        "primitiveID",
        "primitiveName",
        "properties",
        "nodeTitle",
        "image",
        "initPorts",
        "layout"
    ]
}